{
  "schema_revision": "gooseweb-exact-head-clearance/v4",
  "phase_id": "P01",
  "attempt": 3,
  "base_sha": "ca88bfe56719f69fe59151372e0d5aa76b2c92ab",
  "reviewed_range": "ca88bfe56719f69fe59151372e0d5aa76b2c92ab..d7da340c94f4cb34692a122696717e72f357fac1",
  "candidate_head_sha": "d7da340c94f4cb34692a122696717e72f357fac1",
  "candidate_tree_sha": "fb4ccf08803c9ba76a944ec870a8dfe1e7a33c3e",
  "served_head_sha": "d7da340c94f4cb34692a122696717e72f357fac1",
  "served_tree_sha": "fb4ccf08803c9ba76a944ec870a8dfe1e7a33c3e",
  "clean_tree": true,
  "hot_reload": false,
  "manifest": {
    "path": "verification/gooseweb/manifests/p01-team-comms-live.json",
    "revision": 3,
    "sha256": "157deb14a7dca547477d470cde40f25f9c9d01cfb8808b4be73553bc7f68c7f5"
  },
  "approved_plan_sha256": "521073ac7551df15d814b1e84d1be47ec9e80289728d07c3dbab8c5b2b1b3b2c",
  "lease": {
    "lease_id": "gooseweb-migration-000002",
    "sequence": 2,
    "phase_id": "P01",
    "owner_role": "supervisor",
    "owner_identity": "p01-supervisor",
    "acquired_at": "2026-07-12T10:00:00.000Z",
    "released_at": "2026-07-12T10:20:00.000Z",
    "prior_lease_termination_evidence": {
      "status": "terminated_and_cleaned",
      "reference": "ledger lease gooseweb-migration-000001 termination"
    },
    "managed_process": {
      "identity": "gg-process-example-2",
      "started_at": "2026-07-12T10:01:00.000Z",
      "stopped_at": "2026-07-12T10:18:00.000Z",
      "cleanup_completed_at": "2026-07-12T10:19:00.000Z",
      "termination_evidence": "process completion notification and cleanup record"
    }
  },
  "stack": {
    "dev_dir": "tmp/gooseweb-p01-review",
    "runtime_port": 18101,
    "tower_port": 18102,
    "gooseweb_port": 13101,
    "source_configuration": "isolated-local-runtime",
    "branch": "gg/p01-acceptance-foundation",
    "mode": "development-real-worker",
    "configuration_sha256": "670d5416491d76fa18c563b7f9f6280411dbf309efdc64676c4c6fb3d4d1204e"
  },
  "review": {
    "implementer_identity": "p01-implementer",
    "reviewer_identity": "p01-reviewer",
    "reviewer_role": "read_only",
    "browser_mechanism": "agent-browser",
    "browser_session": "gooseweb-p01-review-attempt-3-headless",
    "concurrent_mutation_build_format_generation": false,
    "findings_route": "reviewer_to_implementer",
    "final_approval_routed_to_implementer": false,
    "replacement_reviewer_full_rerun_required": true
  },
  "browser": {
    "mechanism": "agent-browser",
    "execution_mode": "headless",
    "headed_mode_prohibited": true,
    "fresh_unique_session_required": true,
    "chromium_binary": "/Applications/Google Chrome.app/Contents/MacOS/Google Chrome",
    "chromium_version": "150.0.7871.115",
    "profile_policy": "fresh_ephemeral",
    "session_name": "gooseweb-p01-review-attempt-3-headless"
  },
  "baseline_detected": [
    {
      "scenario_id": "GW-P01-TEAM-COMMS-LIVE-001",
      "defect_id": "BASE-P01-TEAM-COMMS-EMPTY",
      "first_divergent_layer": "Goosetower",
      "evidence_references": [
        "tmp/gg/gooseweb-current-state-evidence/gooseweb-team-comms-empty-1440x1000.png"
      ],
      "owning_correction_phase": "P08",
      "affected_downstream_gates": [
        "P10",
        "M1",
        "P45",
        "M5",
        "P56",
        "M7"
      ],
      "product_scenario_status": "blocked_not_approved",
      "description": "Runtime message/delivery/event and injection succeed while Team Comms remains empty."
    },
    {
      "scenario_id": "GW-P01-TEAM-COMMS-LIVE-001",
      "defect_id": "BASE-P01-STALE-TURN",
      "first_divergent_layer": "Goosetower",
      "evidence_references": [
        "tmp/gg/gooseweb-current-state-evidence/gooseweb-live-agent-after-runtime-completion-1440x1000.png"
      ],
      "owning_correction_phase": "P07",
      "affected_downstream_gates": [
        "P10",
        "M1",
        "P25",
        "M3",
        "P45",
        "M5",
        "P56",
        "M7"
      ],
      "product_scenario_status": "blocked_not_approved",
      "description": "Runtime terminal truth succeeds while the materialized/browser session remains turn_running."
    },
    {
      "scenario_id": "GW-P01-TEAM-COMMS-LIVE-001",
      "defect_id": "BASE-P01-START-LEAD-NO-ADMISSION",
      "first_divergent_layer": "browser-command to Goosetower admission/routing boundary",
      "evidence_references": [
        "tmp/gg/gooseweb-migration/P01/7adbae8/attempt-2/report.md#honest-headless-browser-baseline"
      ],
      "owning_correction_phase": "P07",
      "affected_downstream_gates": [
        "P10",
        "M1",
        "P44",
        "P45",
        "M5",
        "P56",
        "M7"
      ],
      "product_scenario_status": "blocked_not_approved",
      "description": "The semantic Start lead control produces no runtime/materialized session, pending state, or visible terminal rejection, so the source-backed Team Comms precondition cannot be established."
    },
    {
      "scenario_id": "GW-P01-TEAM-COMMS-LIVE-001",
      "defect_id": "BASE-P01-RECONNECT-STATE-DISAGREEMENT",
      "first_divergent_layer": "Gooseweb Worker/store to React connection-state projection",
      "evidence_references": [
        "tmp/gg/gooseweb-migration/P01/7adbae8/attempt-2/tower-state.redacted.json",
        "tmp/gg/gooseweb-migration/P01/7adbae8/attempt-2/websocket.json"
      ],
      "owning_correction_phase": "P10",
      "affected_downstream_gates": [
        "P10",
        "M1",
        "P25",
        "M3",
        "P45",
        "P56",
        "M7"
      ],
      "product_scenario_status": "blocked_not_approved",
      "description": "Offline/online and fresh-context reconstruction do not expose an honest connection state; the top level reports degraded while source health reports live."
    },
    {
      "scenario_id": "GW-P01-TEAM-COMMS-LIVE-001",
      "defect_id": "BASE-P01-MOBILE-COMMS-UNREACHABLE",
      "first_divergent_layer": "Gooseweb React responsive navigation",
      "evidence_references": [
        "tmp/gg/gooseweb-migration/P01/7adbae8/attempt-2/viewport-results.json",
        "tmp/gg/gooseweb-migration/P01/7adbae8/attempt-2/screenshots/520x900.png"
      ],
      "owning_correction_phase": "P10",
      "affected_downstream_gates": [
        "P10",
        "M1",
        "P45",
        "P47",
        "M5",
        "P56",
        "M7"
      ],
      "product_scenario_status": "blocked_not_approved",
      "description": "After reload at 520x900, Team Comms is absent from exposed semantic controls, so the critical surface is unreachable."
    },
    {
      "scenario_id": "GW-P01-TEAM-COMMS-LIVE-001",
      "defect_id": "BASE-P01-WEBSOCKET-OBSERVER-UNAVAILABLE",
      "first_divergent_layer": "verification observer boundary",
      "evidence_references": [
        "tmp/gg/gooseweb-migration/P01/7adbae8/attempt-2/websocket.json"
      ],
      "owning_correction_phase": "P06",
      "affected_downstream_gates": [
        "P10",
        "M1",
        "P45",
        "P56",
        "M7"
      ],
      "product_scenario_status": "blocked_not_approved",
      "description": "P01 and agent-browser provide no redacted WebSocket frame observer, so frame behavior is recorded as unavailable and never inferred."
    },
    {
      "scenario_id": "GW-P01-TEAM-COMMS-LIVE-001",
      "defect_id": "BASE-P01-FAVICON-NOT-FOUND",
      "first_divergent_layer": "Gooseweb static asset routing",
      "evidence_references": [
        "tmp/gg/gooseweb-migration/P01/b40131f/attempt-4/report.md#replacement-attempt-4-blockers"
      ],
      "owning_correction_phase": "P10",
      "affected_downstream_gates": [
        "P10",
        "M1",
        "P56",
        "M7"
      ],
      "product_scenario_status": "blocked_not_approved",
      "description": "Every fresh browser attempt requests GET /favicon.ico and receives HTTP 404; the failed request remains blocked until the static asset route is corrected."
    }
  ],
  "known_defects": [],
  "clearance": {
    "scope": "verification_infrastructure_only",
    "recipient_role": "lead",
    "recipient_identity": "parallel_otter",
    "product_approved": false,
    "issued_at": "2026-07-12T10:20:00.000Z"
  }
}
